{
  "schema": 1,
  "name": "specops",
  "version": "0.1.2",
  "operation": "install",
  "kind": "delegated",
  "targets": {
    "claude": {
      "files": [
        {
          "path": "/tmp/stage/.claude/skills/specops/SKILL.md",
          "sha256": "abc123"
        }
      ]
    },
    "codex": {
      "files": [
        {
          "path": "/tmp/stage/.codex/skills/specops/SKILL.md",
          "sha256": "def456"
        }
      ]
    },
    "tools": {
      "files": [
        {
          "path": "/tmp/stage/.local/bin/specops",
          "sha256": "789abc"
        }
      ]
    }
  },
  "warnings": []
}
